"id","property_id","property_name","property_type","gender","description","amenities","in_time","out_time","monthly_tarrif","quarterly_tarrif","halfyearly_tarrif","yearly_tarrif","single_price","double_price","triple_price","quad_price"
"43","43","Placio Exotic Living","pg","female","Placio Exotic Living is a female-only student housing property located close by to Delhi University South Campus. The property offers three types of fully furnished accommodation options to DU Students - Single Occupancy, Double Occupancy and Three Occupancy. All these rooms are carefully designed to provide ample space to the students, making them feel comfortable and at home. These rooms come equipped with pre-installed cupboards, private bathrooms with geyser, clean and soft bedding, delicious breakfast, Lunch and Dinner, to ensure that your college years remain the best phase of your life. Placio Exotic Living also provides its residents with other basic amenities and ensures a clean and healthy environment for anybody who calls it their home.","28,30,31,34,66,68,69,70,71,72,73,74,76,77,79,86,87,88,89,93,94,96,97,98,99,100,101,105","10:00 AM","08:00 PM","1","1","1","1","17000","13500","12500",""
"44","44","Placio Marigold","pg","female","Welcome to Placio Marigold, where student housing isn’t just an apartment; it’s an experience of safe, secure and affordable housing! Featuring fully furnished AC rooms on double and triple sharing basis and all other facilities and amenities to make you feel at home, away from home with basic amenities like laundry, housekeeping, WiFi, drinking water, 24x7 power back-up. Professionally managed, the accommodation has been specially designed to provide everything you need to make your life as a student as easy as possible. We offer TV, closets, tables and chairs in rooms. You will find comfy mattress and soft fluffy pillows plus linen included. All you need is to bring your personal belonging. We are concerned with your personal well-being which translates in a sense of security, which we have ensured with CCTV cameras installed at various location on site, plus phone line for connectivity with parents.  Nutritious and healthy in-house meals are provided. We provide all of the resources you need to lead a balanced social and academic lifestyle. Contact us with any questions that you may have or visit our website to know more details. ","27,30,31,34,61,66,67,68,70,71,72,73,74,77,79,86,87,88,89,93,94,96,98,101,105,106","10:00 PM","06:00 AM","1","1","1","1","18000","16000","",""
"45","45","Placio Salvina 2","pg","female","Located in a very close proximity to DU North Campus, Placio Salvina 2 is the first and only all-female hostel offering secure, safe and fun place for women. We will offer you a homelike atmosphere and make you feel like you are staying among friends at Hudson Lane, GTB Nagar. Everything you need is available --- a clean, safe and beautiful place that will cater to your every need. At Placio Salvina 2 we aim to please and make your stay as comfortable and pleasant as it can be with nutritious tasty in-house quality meals in dining area on every floor. Our double shared AC en-suite room are fully furnished with a comfy mattress, storage, plug sockets with USB charging points, study desk and curtains. Attached bathroom is equipped with geyser, the room has fridge, WiFi, 24x7 power back-up, laundry and housekeeping. For your safety we have 24x7 security, CCTV cameras and parent helpline for stress-free living. Along with modern amenities our emphasis is simple and transparent moving-in process ensuring that you do it in style with Placio. Indeed, with the simple living environment as well as the warmth service exuded by the staff, our accommodations are designed for both relaxing and studying.","27,29,30,31,34,66,70,71,72,73,74,79,86,87,88,89,93,94,96,98,101,105,106","10:00 PM","06:00 AM","1","1","1","1","","17000","",""
"47","47","Placio Angel Paradise","pg","female","Placio Angel Paradise is a female-only student housing property located close by to big Institutes like Kautaliya Academy. The property offers one types of fully furnished accommodation options to students - Double Occupancy and Triple Occupancy. All these rooms are carefully designed to provide ample space to the students, making them feel comfortable and at home. This Placio verified property is located in D-11 Sarvanand Nagar, Bholaram Ustad Marg, Indore and comes equipped with a bike parking facility, room cleaning service, and a warden facility. Since it is a female-only student housing facility, Placio Angel Paradise ensures the safety of each and every resident like its daughters.","31,34,66,70,71,72,73,74,76,79,87,89,93,94,96,98,101,105,106","10:00 AM","07:00 PM","1","1","1","1","","7000","6500",""
"48","48","Placio Salvina 1","pg","female","Placio Salvina 1 offers safe, comfortable and affordable accommodation to only female students in North Campus without compromising on quality, comfort or security. A key reason why Placio Salvina 1 is one of the most popular student accommodation options is its proximity to some of the Delhi University and city’s key colleges -- giving your parents one less thing to worry about. As a resident in Placio’s property you won’t need to worry about in-house meals, parental contacts, laundry, housekeeping and much more. Our accommodation has been built and equipped to the highest possible standards. At Placio Salvina 1, we offer AC fully furnished en-suite rooms on double sharing basis equipped with geyser, comfortable bedding, TV, fridge study tables and chairs. All our rooms have onsite staff to ensure housekeeping, laundry, maintenance, 24x7 power backup, WiFi and secure biometric access and CCTV surveillance for added security making your stay with us as stress free as possible. We want all our students to feel secure and comfortable in their student accommodation. Any issues that may arise will be dealt with promptly by our on site management team. Wardens are present for administrative and supervision purpose. This hostel is ideally located near quick and reliable travel links giving our students freedom to enjoy their time.","27,29,30,34,61,66,67,68,70,71,72,73,74,77,79,86,87,89,93,94,95,96,98,101,105,106","10:00 PM","06:00 AM","1","1","1","1","","16000","",""
"49","49","Placio Inaya","pg","female","Living at Placio Inaya, Tugalkabad Extension is a superior experience. This is top quality buildings in central locations, equipped to the highest standards and with superb facilities.  We at Placio understand that your student days are a unique moment in your life when you want to feel safe and secure and have the liberty to explore South Campus. We pride ourselves on delivering an exceptional student experience by creating superior accommodation that reflects your ambitions. This we do by providing exceptional fully furnished bright, light, luxurious AC rooms on single and double sharing basis for only females.  We know that being a student means that there’s a lot going on and a lot to organise especially if you are an out stationed student. So, Placio at newly opened Inaya now offers solutions to make life a little easier with laundry and housekeeping, WiFi, drinking water, power-backup and monitored CCTVs. This ensures that it is well maintained and, what’s more, it’s safe. Placio has taken over Paco Meals for a unique culinary experience designed fir students with nutritional and yummy meals in house. But most importantly, we add a little wow.
Sleek living spaces and bold social areas at Inaya Student Housing deliver sophisticated style with modern design. Boasting superior features throughout, our luxurious accommodation will ensure your university experience is an unforgettable one. Our accommodation, facilities and locations are second to none and our dedicated staff will do all they can to ensure your stay with us is a happy and memorable one.
","27,29,30,31,34,66,70,71,73,74,79,86,87,89,96,99,105,106","10:00 AM","08:00 PM","1","1","1","1","17000","10000","",""
"50","50","Placio Royal Living","pg","male","Welcome to a new kind of student living experience at Placio Royal Living, designed with you in mind. We are the number one choice for student accommodation because we genuinely care about how you want to live. Living with Placio Housing isn't just about buildings, it’s about safe, secure homes where you can study and socialise in comfort. Our properties are perfectly located near city centres or universities, putting you within easy reach of your college, meaning fewer early-morning commutes. These housing come fully equipped with everything you need. Placio Royal Living offers fully furnished AC rooms on double and triple sharing basis. And all of our residences have plenty of communal spaces for studying or socialising. You'll have everything you need for a flying start to student life.  These days are unique moment in your life, so we pride ourselves on delivering exceptional experiences for a great stay. Your mind will be at ease knowing there’s on-site management teams, safety teams round the clock ready to help you with anything you need during your stay, plus laundry, in-house meals, 24x7 security, parent helpline, CCTV camera, power back-up and biometric keyed entry.  The housing has been designed especially for students – live life to the fullest. You will in due course of time discover for yourself that staying at Placio Royal Living takes all the worry out of moving to a new city. ","30,31,34,61,62,66,71,72,73,74,77,86,87,88,89,93,94,96,97,98,101,105,106","10:00 AM","08:00 PM","1","1","1","1","","13500","12500",""
"51","51","Placio Angel Town","pg","female","Placio Angel Town is a female-only student housing accommodation located in Shakarpur, with service, safety and security at its heart. Placio puts tenant comfort and convenience as our top priority. Modern furnished rooms, a long list of amenities, and prime location near Metro Station makes living here a joy. Getting to lectures is easier as major academic institutions and coaching centres in Laxmi Nagar are just a short walk away. We offer a wide selection of beautifully furnished en-suite single, double and triple occupancy rooms giving you the best of both worlds; privacy when you want it or fun in the shared in-house dining or an extensive array of common spaces and facilities giving you the opportunity to socialize and study with friends. Your security is of prime importance to us so we offer onsite 24x7 CCTV security cameras, warden, security guards, parent’s helpline providing for your peace of mind. Our amenities include a fully furnished room, on-site residence team, on-site maintenance team, high-speed WiFi throughout the building, AC, TV, on-site laundry facilities and fridge. We’ve got everything covered because our mission is to help you make the most of your time, so we take care of all the little things so you don’t have to.","29,30,31,34,66,70,71,72,73,74,79,86,87,88,89,93,94,96,97,98,101,105,106","10:00 AM","08:00 PM","1","1","1","1","14000","12500","11500",""
"52","52","Placio RG Niwas","pg","female","Placio RG Niwas is comfortable, hassle-free student accommodation for only women in Shakarpur, which is primarily a residential area but there’s plenty to keep you occupied with coaching institutes in Lakshmi Nagar which is within walking distance, besides this, the area has thriving restaurants and shopping opportunities. The residence has your comfort, convenience and security in mind by having 24-hour CCTV security surveillance and parent helpline. Here, Placio offers a wide selection of beautifully furnished en-suite AC rooms on double sharing basis along with comfortable bedding, TV, fridge, WiFi, on-site laundry, on-site housekeeping services. Bedrooms are spacious and have en-suite bathrooms equipped with geysers. Bedroom furniture includes a large bed, wardrobe, desk and chair. Plus common spaces to socialize and study with friends. We have on-site residence team, maintenance team to take care of break-downs so that you can make the most of your time for academics. We also cater tasty, healthy and nutritious in-house meals served in the dining room. Great connectivity with several local bus routes makes it easy to get around. All in all, Placio RG Niwas provides a home-like comfort to students starting a new and important chapter of their lives Laxmi Nagar, Delhi.","30,31,34,66,70,71,72,73,74,86,87,88,89,93,94,96,98,101,105,106","10:00 AM","08:00 PM","1","1","1","1","","10500","9500",""
"53","53","Placio Paradise","pg","male","Living in Placio Paradise is about safe, secure homes where you can study and socialise in comfort. Placios properties are perfectly located near city centres or universities, and come fully equipped with everything you need, including wi-fi, inclusive bills, study space and social areas. We want you to feel right at home, and we know that means providing more than just a great place to stay. Whether you're studying in North Campus or socialising or just getting to know your new city, you'll have everything you need for a flying start to student life. These days are unique moment in your life, so we pride ourselves on delivering an exceptional student experience by providing single, double and triple occupancy fully furnished AC rooms equipped with all the facilities required for you to have a great stay. Your mind will be at ease knowing there’s on-site management teams, safety teams round the clock ready to help you with anything you need during your stay, plus laundry, in-house meals, 24x7 security, parent helpline, CCTV camera, power back-up and biometric keyed entry. Everything you need for a hassle-free stay is covered by us. The rooms in Placio Paradise are designed especially for students - large desks give you enough space to spread out and get studying in a relaxing, homely environment.","30,31,32,66,71,72,73,74,79,86,87,89,93,94,96,98,101,105,106","10:00 PM","06:00 AM","1","1","1","1","14000","10500","13500","10500"
"54","54","Placio Ashoka Inn","pg","male","Placio Ashoka Inn housing redefines student living experience. We are a dedicated to providing affordable student housing because we understand going to university can be a wonderful life-changing experience. Living in a place like Placio Ashoka Inn draws out the necessary qualities for living and working together with others from very diverse backgrounds. This is a place for forging deep friendships and it provides a fantastic study environment. We provide students with lasting experiences and have encouraged them to aspire to achieve all their ambitions.
Placio understands the importance of quality living, health & safety of residential life. There is onsite hospitality management staff to ensure residences are maintained to a high standard. Residences have security access control systems and parental helpline allowing our residents to focus on their student experience. Placio Ashoka Inn offers fully-furnished single and double occupancy clean, warm and well-lit AC rooms with attached bathroom. In the rooms TV, closets and comfortable mattress with pillows are provided. Laundry, WiFi, in-house meals are also taken care of. CCTV cameras are monitored for security and parental helpline are provided for student and parental peace of mind. Our communal areas are great to mingle with other students or to use for group study. Our student accommodations are all located for quick and reliable transport links – and are even walking distance from popular university campuses and academic institutions.
","28,30,31,34,62,66,70,71,72,73,79,86,87,89,93,94,96,98,99,101,105,106","10:00 AM","08:00 PM","1","1","1","1","15000","11000","",""
"55","55","Placio Pearl","pg","female","Coming soon...","29,30,34,66,71,72,73,74,77,79,86,87,88,89,92,93,94,96,97,98,101,105,106","10:00 PM","06:00 AM","1","1","1","1","","22000","","16000"
"56","56","Placio Sangam Residency","pg","female","One of the newest additions to Placio Housing is this brand new Residency -- undoubtedly an ideal destination for premier off-campus living designed with students in mind. A female only accommodation with chic finishes, convenient location and that’s just the beginning as the housing permits you to cook and offers induction cooker, utensil, microwave and fridge. You can grab some groceries and cook a meal for yourself or walk to the mess as there is provision of tasty and nutritious in-house meals also. The fully furnished AC rooms are certain to satisfy just about any student. These come with attached bathroom equipped with geyser, shared TV in room, Wi-Fi, drinking water, laundry, housekeeping and onsite maintenance services. Security and safety have been kept in mind with monitored CCTVs, warden and parental helpline. Quiet, generously sized and fully equipped spaces to strengthen strong study habits have been provided. The residency is situated in an ideal location within walking distance from local shopping, dining, and entertainment destinations. What are you waiting for? Be the first to experience this off-campus gem. Reserve your spot today...while they last!","27,28,29,30,31,32,34,61,62,66,73,74,76,81,86,87,88,89,92,93,95,96,99,101,105,106","10:00 PM","09:00 AM","1","1","1","1","","","",""
"57","57","Placio Lily","pg","female","Located near Delhi University North Campus, Placio Lily redefines the student living experience. We want you to feel right at home, and know that means providing more than just a place to stay. We welcome all our female residents to a new kind of student living experience, designed with just you in mind keeping safety and security at the top of our concerns. We are the number one choice for female students seeking admissions in North Campus Colleges because Placio understands the importance of quality living with in-house team and a warden responsible for day-to-day security, health & safety of residential life by monitoring through CCTV camera’s. There is onsite hospitality management staff to ensure residences are maintained to a high standard. Residences have security access control systems and parental helpline allowing our residents to focus on their student experience. Placio Lily offers fully-furnished double occupancy clean, warm and well-lit AC rooms with attached bathroom, in room TV, closets and comfortable mattress with pillows. Laundry, WiFi, in-house meals are also taken care of. Our communal areas are great to mingle with other students or to use for group study. Our student accommodations are all located for quick and reliable transport links – and are even walking distance from popular university campuses and academic institutions.","29,30,31,34,66,71,72,73,74,77,79,86,87,88,89,93,94,96,98,101,105,106","10:00 PM","06:00 AM","1","1","1","1","","16000","",""
"58","58","Placio Oasis 3","pg","female","Your new home in the heart of Delhi, moving here can be extremely exciting, but it can also be a little overwhelming. At Placio Oasis 3, we’re like your friends who know what’s good, where to eat and how to make the most of your stay. We’ve been the leading provider of student housing. Let’s find your place.  Convenient and safe student housing are the key to academic success. Placio Oasis 3 is a female-only student housing property helping you make the most of your stay. We offer a wide selection of beautifully furnished en-suite double and triple occupancy AC rooms with closets, chair and desk. TV and fridge are provided in the room.  An extensive array of common spaces and facilities are also facilitate  socializing and study with friends. Your security is of prime importance to us so we offer onsite 24x7 CCTV security cameras, warden, security guards, parent’s helpline providing for your peace of mind. Our amenities include fully furnished rooms, on-site residence team, on-site maintenance team, high-speed WiFi throughout the building, in-house meals, along with on-site laundry facilities and housekeeping. We’ve got everything covered because our mission is to help you make the most of your time.","27,30,31,34,66,71,72,73,74,77,79,86,87,88,89,93,94,96,98,101,105,106","10:00 PM","06:00 AM","1","1","1","1","","15500","13500","12000"
"59","59","Placio Pride Stay","pg","male","Placio Pride Stay has been started with the idea to provide a safe and fun place for male students. We know that the transition from school to college and can be a mix of anticipation, excitement and anxiety.  Nothing provides a sense of balance for a student away at college more than a feeling of home. That sense of belonging paired with a sense of independence is what we at Placio Pride Stay strive to offer with our unparalleled amenities to our high level of security, we want to make sure our residents feel at home. Placio is about supporting students who live with us, in a way that represents all of their best interests of comfort, health and well-being. All this involves making you feel safe and comfortable.  We provide fully furnished big and comfortable AC rooms on single, double and triple sharing basis with attached bath. Each room has TV, closets, tables and chairs. You will find comfy mattress and soft fluffy pillows plus linen. Placio Pride Stay offers homelike atmosphere, clean, safe and beautiful place with laundry, housekeeping, WiFi, drinking water, 24x7 power back-up.  Your security is of prime importance, which we insure with CCTV cameras installed on premises, security and guards and parent helpline. Along with this your health is of concern to us and we provide nutritious in-house meals. ","31,34,71,72,73,74,77,79,86,87,88,89,93,96,98,99,101,105","10:00 AM","08:00 PM","1","1","1","1","16000","11000","9000",""
"60","60","Placio JP House","pg","male","Your student housing search ends with Placio JP House. Remember your college experience is important. Part of the experience includes where you live during your college years. Placio JP House has been designed with your comfort and convenience in mind, offering a variety of amenities to ensure that you are happy living in their new home. We are right in the centre, close to shops, restaurants and big institute like IGP, Aldine Institute located in Laxmi Nagar. We want your time with us to be as stress-free as possible so you can focus on the things that matter most, like enjoying your time as a student. Privacy is a welcomed feature, as Placio offers spacious double and triple occupancy fully-furnished rooms including not just mattresses but pillows, fridge and personal bathroom with geysers. All basic utilities are included like closets, ACs, laundry, room cleaning, high-speed WiFi, in-house dining, power back-up and parent helpline. Your safety is paramount to us, which is why we have CCTV and secure door entry systems in place. Moving-in will be a breeze – just another way we make things easier on you (and your parents). Students will only need to bring their personal belonging. Contact us with any questions that you may have or to schedule a tour!","30,31,34,66,70,71,72,73,74,79,87,88,89,93,94,96,98,101,105,106","10:00 PM","07:00 AM","1","1","1","1","","10000","8000",""
"61","61","Placio Crystal Homez","pg","female","Placio Crystal Homez is a female-only student accommodation. Placio is concerned about your well-being, security, health and happiness as well as providing you with exceptional quality accommodation, we are dedicated to making sure you have the best experience while you're living with us. This means focusing on you to make sure you feel safe, healthy and happy at all times. Your safety is extremely importance to us. Making your accommodation become your home gives you the edge to relax and concentrate on what matters – your academics. We offer fully furnished AC room with double sharing option. This is a one-stop solution to student accommodation, which includes maintenance, laundry and housekeeping services for cleaning, CCTV and a 24-hour helpline. This is peace of mind – not only for residents, but for their parents or guardians as well. These rooms are equipped with pre-installed cupboards, fridge, private bathrooms with geyser, clean and soft bedding. We also provide WiFi and TV in rooms. Clean drinking water and nutritious meals are provided in our dining rooms which our extensive menu ensures a balanced meal for residents. Placio intends to provide a new kind of student living experience, one that’s designed to help you achieve your social, academic and career goals. Come home to an awesome living.","31,34,66,71,72,73,74,86,87,89,93,94,96,98,101,105,106","10:00 AM","08:00 PM","1","1","1","1","","17000","",""
